{
  "vendor": "juniper_srx",
  "device": "fw-snapshot",
  "schema_version": 2,
  "mode": "debug",
  "nat_rule_count": 0,
  "evaluation_model": {
    "nat_type_precedence": [
      "static",
      "destination",
      "source"
    ],
    "rule_order_within_context": "top_down_first_match"
  },
  "contexts": [],
  "supporting_objects": {
    "translation_pools": []
  }
}
